{"argv_sha256":"c691436b0f7f99be4555869ddb18906f72f101751f0ed6f86332a0409c4aa7a1","command_id":"TASK9_AFFECTED_INTEGRATION","correction_round":0,"cwd_key":"1ecc6194cbbea341b81751c592c384259045cef2dfb8b6a2b8dba2a1f3816d00","duration_ms":104883,"exit_code":1,"gate":"AFFECTED_INTEGRATION","outcome":"FAIL","patch_sha256":"4b78ad0fc38ab0379f08504296a223ac0b427ab112f6c833cbfcf3bed1062552","protocol":"helios.build.command-receipt/v1","started_at":"2026-09-01T16:41:06.920323Z","stderr_sha256":"8774e47416db2724000389902b304f02f4f76f540ffa4c9ad707b887c0c01737","stderr_truncated":false,"stdout_sha256":"e3b0c44298fc1c149afbf4c8996fb92427ae41e4649b934ca495991b7852b855","stdout_truncated":false,"task_manifest_sha256":"bc197ed65c19119a9a66fca50e7ea03dc5f266f67ffb0e448abf6919b8d3b56a"}