{"argv_sha256":"90c2a004a4cbeac5611537996802024f34c22c731dac994eb6d7dcf0dd085c36","command_id":"DIV23_V2_REGISTRY_FOCUSED","correction_round":1,"cwd_key":"1ecc6194cbbea341b81751c592c384259045cef2dfb8b6a2b8dba2a1f3816d00","duration_ms":365,"exit_code":0,"gate":"FOCUSED","outcome":"PASS","patch_sha256":null,"protocol":"helios.build.command-receipt/v1","started_at":"2026-09-01T17:52:34.069937Z","stderr_sha256":"4d41ed274cf2b4da28e0ebb893e24a9d8f5a62f5e16776c5e2c3cfcec51c8e66","stderr_truncated":false,"stdout_sha256":"e3b0c44298fc1c149afbf4c8996fb92427ae41e4649b934ca495991b7852b855","stdout_truncated":false,"task_manifest_sha256":"009fb2a8b371c83a089f25573e2818043f9dd7b18377b54fa73663c28a265fec"}