{"argv_sha256":"91594275f04b8fc87495dcc230f1e546b2b299f95922971c5f7592d91cfa1e69","command_id":"DIV23_V2_CALCULATION_ASSEMBLY_FOCUSED","correction_round":0,"cwd_key":"1ecc6194cbbea341b81751c592c384259045cef2dfb8b6a2b8dba2a1f3816d00","duration_ms":265,"exit_code":0,"gate":"FOCUSED","outcome":"PASS","patch_sha256":null,"protocol":"helios.build.command-receipt/v1","started_at":"2026-09-01T19:03:11.352828Z","stderr_sha256":"af9d19e600ebe026ce959cddf1645dd5e196370728ff0bc36a3cee5596da772a","stderr_truncated":false,"stdout_sha256":"e3b0c44298fc1c149afbf4c8996fb92427ae41e4649b934ca495991b7852b855","stdout_truncated":false,"task_manifest_sha256":"54cf68822cc8e4f42a0f2e095ee8be55854f51a594bfd1fd9d93e188fd83b164"}