{"argv_sha256":"67ba4ecb782f0c0ed0298e12b1a792907c8e14e6608b5428b0ed45c688a286c6","command_id":"DIV23_V2_REGISTRY_AFFECTED","correction_round":0,"cwd_key":"1ecc6194cbbea341b81751c592c384259045cef2dfb8b6a2b8dba2a1f3816d00","duration_ms":1719,"exit_code":0,"gate":"AFFECTED_INTEGRATION","outcome":"PASS","patch_sha256":"7eca31d1a8eddba4af68df6dc7e161c4f868e4d70ed53baf7c97adf71eb80810","protocol":"helios.build.command-receipt/v1","started_at":"2026-09-01T18:24:25.066926Z","stderr_sha256":"e97b17b73fa0805f9635281fd7f5648eeec8f6e2e7e4c6b0bc1656513498551b","stderr_truncated":false,"stdout_sha256":"e3b0c44298fc1c149afbf4c8996fb92427ae41e4649b934ca495991b7852b855","stdout_truncated":false,"task_manifest_sha256":"4d86abcf67e37d724b8def4ac1e4682f7d90a131a75fd3ff9997ab7161e90835"}