{"argv_sha256":"ba0e636d3931042efc24c5bf84cef7d6f62b68106d0c1a4dd5cef9edb91d81ad","command_id":"ATHENA_PACKET_INTAKE_FOCUSED","correction_round":0,"cwd_key":"1ecc6194cbbea341b81751c592c384259045cef2dfb8b6a2b8dba2a1f3816d00","duration_ms":10146,"exit_code":0,"gate":"FOCUSED","outcome":"PASS","patch_sha256":null,"protocol":"helios.build.command-receipt/v1","started_at":"2026-09-01T18:14:58.908385Z","stderr_sha256":"497d06dfc89180d0ffa763782e168f9de8cb3f36f08820de0fe14fffe5c68eed","stderr_truncated":false,"stdout_sha256":"e3b0c44298fc1c149afbf4c8996fb92427ae41e4649b934ca495991b7852b855","stdout_truncated":false,"task_manifest_sha256":"8efeed58f367f6984fea4fe3d33c41e27599246011eed26c99219e04caa58979"}