{"argv_sha256":"7daad51d05755325b1ed4f40ba09987d82b6bee0c8e0a9647b54c84c18b6a3dd","command_id":"TASK9C_AFFECTED_INTEGRATION","correction_round":0,"cwd_key":"1ecc6194cbbea341b81751c592c384259045cef2dfb8b6a2b8dba2a1f3816d00","duration_ms":102797,"exit_code":0,"gate":"AFFECTED_INTEGRATION","outcome":"PASS","patch_sha256":"8ca904c9158e63718e57626b356851d56a8b573600ec0784cfd205eef700b096","protocol":"helios.build.command-receipt/v1","started_at":"2026-09-01T17:12:18.609464Z","stderr_sha256":"651d24c8b925414e8a4a2a722d54fd3ae38c8a85979e1446cd58bd294e516b83","stderr_truncated":false,"stdout_sha256":"e3b0c44298fc1c149afbf4c8996fb92427ae41e4649b934ca495991b7852b855","stdout_truncated":false,"task_manifest_sha256":"3993b8d0bfa76bd18b49b0054d868f073e5404cebcfccd60e4c5565ce0a8f0e9"}