{"argv_sha256":"67ba4ecb782f0c0ed0298e12b1a792907c8e14e6608b5428b0ed45c688a286c6","command_id":"DIV23_V2_REGISTRY_AFFECTED","correction_round":1,"cwd_key":"1ecc6194cbbea341b81751c592c384259045cef2dfb8b6a2b8dba2a1f3816d00","duration_ms":1519,"exit_code":0,"gate":"AFFECTED_INTEGRATION","outcome":"PASS","patch_sha256":"03f3b7104e97632cd5ef882b57aa670b44f13b9ead91b30ad76a7f7f2b0f7c64","protocol":"helios.build.command-receipt/v1","started_at":"2026-09-01T18:00:20.690553Z","stderr_sha256":"e19b3663a0df0e7fb3bf22d9a4ffa81c81b392e729b73930b2c8a91f1609b5e5","stderr_truncated":false,"stdout_sha256":"e3b0c44298fc1c149afbf4c8996fb92427ae41e4649b934ca495991b7852b855","stdout_truncated":false,"task_manifest_sha256":"009fb2a8b371c83a089f25573e2818043f9dd7b18377b54fa73663c28a265fec"}