{"argv_sha256":"5573237fa00a3a9e3ccc8090b94bf58516a99496effe6cda853417a47dcfdece","command_id":"TASK9R1_FOCUSED","correction_round":0,"cwd_key":"1ecc6194cbbea341b81751c592c384259045cef2dfb8b6a2b8dba2a1f3816d00","duration_ms":6534,"exit_code":0,"gate":"FOCUSED","outcome":"PASS","patch_sha256":null,"protocol":"helios.build.command-receipt/v1","started_at":"2026-09-01T16:50:49.714967Z","stderr_sha256":"17ff1041ed91ad522af9bdfd313b9d16545820e6ac07619f88f6fd23175b2ecd","stderr_truncated":false,"stdout_sha256":"e3b0c44298fc1c149afbf4c8996fb92427ae41e4649b934ca495991b7852b855","stdout_truncated":false,"task_manifest_sha256":"c1c0e67a963c90985a5dae08fead23ed1e204e8a5cc51148e7abe11d54ba9c4f"}