{"argv_sha256":"854bcc940861942276f510a4c1885705f6c816775146fc8ebc74b3d6f4e00df7","command_id":"ATHENA_PACKET_INTAKE_AFFECTED","correction_round":0,"cwd_key":"1ecc6194cbbea341b81751c592c384259045cef2dfb8b6a2b8dba2a1f3816d00","duration_ms":20324,"exit_code":0,"gate":"AFFECTED_INTEGRATION","outcome":"PASS","patch_sha256":"44b7338338cd91febb98f4d34368a2b7ece9b3356b89842ab23245d3be24cf05","protocol":"helios.build.command-receipt/v1","started_at":"2026-09-01T18:27:20.901576Z","stderr_sha256":"0ea1c3d12416010af505a0c58dfce6e5244ae70ac13be2642c4fcfac48480bad","stderr_truncated":false,"stdout_sha256":"e3b0c44298fc1c149afbf4c8996fb92427ae41e4649b934ca495991b7852b855","stdout_truncated":false,"task_manifest_sha256":"8efeed58f367f6984fea4fe3d33c41e27599246011eed26c99219e04caa58979"}