{"argv_sha256":"66a64c1095b925f2ea55b6c373a64b6bae22737a2eddccec943113d3c7191305","command_id":"DIV23_V2_CALCULATION_ASSEMBLY_AFFECTED","correction_round":1,"cwd_key":"1ecc6194cbbea341b81751c592c384259045cef2dfb8b6a2b8dba2a1f3816d00","duration_ms":1268,"exit_code":0,"gate":"AFFECTED_INTEGRATION","outcome":"PASS","patch_sha256":"3c44a58e977acdc4f392a03c182f2916d41808a648a90867ef84e7005ba0989e","protocol":"helios.build.command-receipt/v1","started_at":"2026-09-01T19:26:56.550256Z","stderr_sha256":"a1237d2101f02a934fb9aceadacd3a2d8200c19b5b8b74be82682c17477a5def","stderr_truncated":false,"stdout_sha256":"e3b0c44298fc1c149afbf4c8996fb92427ae41e4649b934ca495991b7852b855","stdout_truncated":false,"task_manifest_sha256":"d7818473288fea00e14aa44c99d6b05077375edf317c7e772e093028804c9117"}