{"argv_sha256":"66a64c1095b925f2ea55b6c373a64b6bae22737a2eddccec943113d3c7191305","command_id":"DIV23_V2_CALCULATION_ASSEMBLY_AFFECTED","correction_round":0,"cwd_key":"1ecc6194cbbea341b81751c592c384259045cef2dfb8b6a2b8dba2a1f3816d00","duration_ms":1167,"exit_code":0,"gate":"AFFECTED_INTEGRATION","outcome":"PASS","patch_sha256":"ddc942643759664ca28954726a6a443a3ccfee3210c9d98532374027880efb4d","protocol":"helios.build.command-receipt/v1","started_at":"2026-09-01T19:12:07.120965Z","stderr_sha256":"1d4c3f553aaa908f7345cea313e0984833511bae65f157e6e4849429d74dc12f","stderr_truncated":false,"stdout_sha256":"e3b0c44298fc1c149afbf4c8996fb92427ae41e4649b934ca495991b7852b855","stdout_truncated":false,"task_manifest_sha256":"54cf68822cc8e4f42a0f2e095ee8be55854f51a594bfd1fd9d93e188fd83b164"}