{"argv_sha256":"30a7e2f15510baa979112a7211b5a1f51518e405066945555e57f5710aaadc31","command_id":"TASK9C_FOCUSED","correction_round":0,"cwd_key":"1ecc6194cbbea341b81751c592c384259045cef2dfb8b6a2b8dba2a1f3816d00","duration_ms":11048,"exit_code":0,"gate":"FOCUSED","outcome":"PASS","patch_sha256":null,"protocol":"helios.build.command-receipt/v1","started_at":"2026-09-01T17:08:20.717512Z","stderr_sha256":"779848238d685b5439f6d78487cf6a8cc6161f87689494d58cc994ee62c4178d","stderr_truncated":false,"stdout_sha256":"e3b0c44298fc1c149afbf4c8996fb92427ae41e4649b934ca495991b7852b855","stdout_truncated":false,"task_manifest_sha256":"3993b8d0bfa76bd18b49b0054d868f073e5404cebcfccd60e4c5565ce0a8f0e9"}