{"argv_sha256":"67ba4ecb782f0c0ed0298e12b1a792907c8e14e6608b5428b0ed45c688a286c6","command_id":"DIV23_V2_REGISTRY_AFFECTED","correction_round":0,"cwd_key":"1ecc6194cbbea341b81751c592c384259045cef2dfb8b6a2b8dba2a1f3816d00","duration_ms":1418,"exit_code":0,"gate":"AFFECTED_INTEGRATION","outcome":"PASS","patch_sha256":"1057697c82a43e69119377bf9eb1084da3fe6e62f1316792718b4241f8bcd6b7","protocol":"helios.build.command-receipt/v1","started_at":"2026-09-01T17:39:37.612213Z","stderr_sha256":"f137ae9c06ac8852de165c901729ccc395268640a07cdd5443580c20f7adb3d5","stderr_truncated":false,"stdout_sha256":"e3b0c44298fc1c149afbf4c8996fb92427ae41e4649b934ca495991b7852b855","stdout_truncated":false,"task_manifest_sha256":"af00422557e8eb5bf06b99dfde8c6777d23f8af5c8f760d6bcbc853d2699f486"}