{"argv_sha256":"5573237fa00a3a9e3ccc8090b94bf58516a99496effe6cda853417a47dcfdece","command_id":"TASK9_FOCUSED","correction_round":0,"cwd_key":"1ecc6194cbbea341b81751c592c384259045cef2dfb8b6a2b8dba2a1f3816d00","duration_ms":6532,"exit_code":1,"gate":"FOCUSED","outcome":"FAIL","patch_sha256":null,"protocol":"helios.build.command-receipt/v1","started_at":"2026-09-01T16:35:06.549997Z","stderr_sha256":"cb47a302ef02d9ea6d859b8c6b639899c7b67fec23e1f4f6ab2af233333487ae","stderr_truncated":false,"stdout_sha256":"e3b0c44298fc1c149afbf4c8996fb92427ae41e4649b934ca495991b7852b855","stdout_truncated":false,"task_manifest_sha256":"bc197ed65c19119a9a66fca50e7ea03dc5f266f67ffb0e448abf6919b8d3b56a"}