{"argv_sha256":"c691436b0f7f99be4555869ddb18906f72f101751f0ed6f86332a0409c4aa7a1","command_id":"TASK9R1_AFFECTED_INTEGRATION","correction_round":0,"cwd_key":"1ecc6194cbbea341b81751c592c384259045cef2dfb8b6a2b8dba2a1f3816d00","duration_ms":102870,"exit_code":1,"gate":"AFFECTED_INTEGRATION","outcome":"FAIL","patch_sha256":"b0ba51a76cfd66cec18bb059dafd0d4de7b51ed259fd50877a8d7c37d0830749","protocol":"helios.build.command-receipt/v1","started_at":"2026-09-01T16:55:57.816263Z","stderr_sha256":"1d35e9f0ad72adf0b49783341e0701f7aa4872a3e23dd9baa6c6fd6bb173a138","stderr_truncated":false,"stdout_sha256":"e3b0c44298fc1c149afbf4c8996fb92427ae41e4649b934ca495991b7852b855","stdout_truncated":false,"task_manifest_sha256":"c1c0e67a963c90985a5dae08fead23ed1e204e8a5cc51148e7abe11d54ba9c4f"}