{"argv_sha256":"854bcc940861942276f510a4c1885705f6c816775146fc8ebc74b3d6f4e00df7","command_id":"ATHENA_PACKET_INTAKE_AFFECTED","correction_round":1,"cwd_key":"1ecc6194cbbea341b81751c592c384259045cef2dfb8b6a2b8dba2a1f3816d00","duration_ms":21531,"exit_code":0,"gate":"AFFECTED_INTEGRATION","outcome":"PASS","patch_sha256":"422c539d20e634c1025437b79122ac0aa75e7f9013444e4da035ae88221fae98","protocol":"helios.build.command-receipt/v1","started_at":"2026-09-01T18:50:53.152569Z","stderr_sha256":"fae8a43c30e28a39d96e7cc80e936c81b61d7ce59d8034e174fbb6832f39eeb7","stderr_truncated":false,"stdout_sha256":"e3b0c44298fc1c149afbf4c8996fb92427ae41e4649b934ca495991b7852b855","stdout_truncated":false,"task_manifest_sha256":"7607569e69e36895aabb4ed87996dfd0701e6745dac1818d4f88e5887f96cf8f"}